[
  {
    "record_id": "deploy-2026-04-01-capability-y",
    "timestamp": "2026-04-01T10:00:00Z",
    "context": "Planned deploy of capability-y v2 to general availability.",
    "decision": "Deploy capability-y v2 to general availability with standard monitoring.",
    "options": [
      "Deploy to general availability",
      "Deploy to a staged cohort",
      "Do not deploy"
    ],
    "status": "complete",
    "impact": 1,
    "tags": ["deploy", "capability-y"]
  },
  {
    "record_id": "deploy-2026-04-16-patched",
    "timestamp": "2026-04-16T15:00:00Z",
    "context": "Patched redeploy of capability-y. The accompanying incident, rollback, and post-incident review were handled in the incident tracker and not captured as DRP records. This record is the only link back to the 2026-04-01 deploy, and even that link is missing.",
    "decision": "Redeploy capability-y v2.1 (patched) to general availability.",
    "options": [
      "Redeploy patched v2.1",
      "Retain rollback indefinitely",
      "Replace capability-y"
    ],
    "rationale": "Fix verified and re-tested.",
    "status": "complete",
    "impact": 1,
    "tags": ["deploy", "capability-y", "post-incident"]
  }
]
